{
  "name": "google-meet",
  "title": "Google Meet",
  "displayName": "Google Meet",
  "description": "Google Meet REST API v2 connector (past conference records). Read-only.",
  "serviceLabel": "Google Meet API",
  "style": "rest-kit",
  "network": ["www.googleapis.com", "meet.googleapis.com", "oauth2.googleapis.com"],
  "syncInterval": 21600,
  "minNimbusVersion": "0.2.0",
  "env": [{ "vars": ["GOOGLE_OAUTH_ACCESS_TOKEN"], "local": "tokenHeaders", "bindings": ["t"], "auth": "bearer" }],
  "fetchHelper": { "local": "meetFetch", "base": "https://meet.googleapis.com/v2" },
  "tools": [
    {
      "name": "google_meet_list",
      "description": "List past Google Meet conference records (metadata: id, startTime, endTime, space). Pagination via pageToken.",
      "impl": "stub"
    },
    {
      "name": "google_meet_get",
      "description": "Get a single Google Meet conference record by id (startTime, endTime, space).",
      "args": { "conferenceRecordId": { "type": "string", "min": 1 } },
      "path": "/conferenceRecords/${arg.conferenceRecordId|enc}"
    },
    {
      "name": "google_meet_search",
      "description": "Search past conference records (metadata only). Supports the Meet API filter expression and pagination.",
      "impl": "stub"
    }
  ]
}
