{
  "name": "zendesk",
  "title": "Zendesk",
  "displayName": "Zendesk",
  "description": "Zendesk Support connector (read-only). Surfaces the user's Zendesk tickets as `zendesk:ticket` items in the local index — the subject, the plain-text description (the first comment), status (new/open/pending/hold/solved/closed), priority, type, requester/assignee/group/organization ids, tags, and the originating via-channel. Useful for correlating customer support history with code/PR changes (\"which tickets reference the checkout regression?\") without leaving Nimbus. HTTP Basic auth: the username is `<email>/token` and the password is the API token (`Authorization: Basic base64(<email>/token:<api_token>)`; never logged). Zendesk is per-tenant: the user supplies the full base URL `https://<subdomain>.zendesk.com` via the `zendesk.url` vault key, and that host is added to the sandbox network list at spawn time by `phase3AddZendeskMcp`, so the static manifest network list is intentionally empty. Zendesk cursor-paginates `/api/v2/tickets.json` (`page[size]=100`), following `meta.after_cursor` while `meta.has_more` is true. `created_at` / `updated_at` are ISO-8601 (converted to epoch-ms on index). v1 indexes tickets only — comments, users, organizations, and Help Center articles are deferred follow-ups; reply/solve/assign HITL writes are deferred.",
  "serviceLabel": "Zendesk",
  "style": "read-only-kit",
  "handlerStyle": "block",
  "argsSchemaStyle": "expanded",
  "network": [],
  "filesystem": { "read": [], "write": [] },
  "syncInterval": 600,
  "minNimbusVersion": "0.2.0",
  "env": [
    {
      "vars": ["ZENDESK_URL"],
      "local": "baseUrl",
      "bindings": ["v"],
      "required": true,
      "transform": "trimTrailingSlashFn"
    },
    {
      "vars": ["ZENDESK_EMAIL", "ZENDESK_API_TOKEN"],
      "local": "authHeader",
      "bindings": ["email", "token"],
      "auth": "basic",
      "suffix": "/token"
    }
  ],
  "fetchHelper": {
    "local": "zendeskGet",
    "base": "${env.baseUrl}",
    "headers": "authHeader",
    "staticPathStyle": "template"
  },
  "tools": [
    {
      "name": "zendesk_list",
      "description": "List the user's Zendesk tickets (`GET /api/v2/tickets.json?page[size]=100`). Returns the cursor-pagination envelope `{ tickets: [...], meta: { has_more, after_cursor }, links: { next } }` — `tickets` holds the ticket objects.",
      "path": "/api/v2/tickets.json?page[size]=100"
    },
    {
      "name": "zendesk_get",
      "description": "Fetch one Zendesk ticket by its numeric id (`GET /api/v2/tickets/{id}.json`). Returns the `{ ticket: {...} }` envelope. Throws when no match is found.",
      "args": { "id": { "type": "string", "min": 1 } },
      "path": "/api/v2/tickets/${arg.id|enc}.json"
    },
    {
      "name": "zendesk_search",
      "description": "Substring search across the user's Zendesk tickets (first page only). Matches the query against the ticket subject, description, status, priority, type, and tags (case-insensitive). Returns a `{ matches: [...] }` envelope.",
      "impl": "search",
      "path": "/api/v2/tickets.json?page[size]=100",
      "rows": "tickets",
      "maxLimit": 100,
      "filter": {
        "export": "filterZendeskTickets",
        "fields": ["subject", "description", "status", "priority", "type"],
        "tags": true
      }
    }
  ]
}
